<?xml version="1.0" encoding="utf-8" ?>
<Catalog xmlns:xsi="http://www.w3.org/2001/XMLSchema-instance" xsi:noNamespaceSchemaLocation="../../../../schemas/SchemaUpgradeData.xsd">
    <CUpgrade id="AP_BaseProtossGroundWeapons">
        <!-- Override -->
        <EffectArray Reference="Weapon,PrologueZeratul,Level" Value="1"/>
        <EffectArray Reference="Effect,PrologueZeratul,Amount" Value="5"/>
    </CUpgrade>
    <CUpgrade id="AP_ProtossGroundWeaponsQuatro">
        <!-- Override -->
        <EffectArray Reference="Weapon,PrologueZeratul,Level" Value="1"/>
        <EffectArray Reference="Effect,PrologueZeratul,Amount" Value="5"/>
    </CUpgrade>
    <CUpgrade id="AP_ProtossGroundWeaponsPreplacedNoBuild">
        <!-- Override -->
        <EffectArray Reference="Weapon,PrologueZeratul,Level" Value="1"/>
        <EffectArray Reference="Effect,PrologueZeratul,Amount" Value="5"/>
    </CUpgrade>
    <CUpgrade id="AP_ProtossGroundWeaponsLevel1">
        <!-- Override -->
        <EffectArray Reference="Weapon,PrologueZeratul,Level" Value="1"/>
        <EffectArray Reference="Effect,PrologueZeratul,Amount" Value="5"/>
        <EffectArray Operation="Set" Reference="Weapon,PrologueZeratul,Icon" Value="Assets\Textures\btn-upgrade-protoss-groundweaponslevel1.dds"/>
    </CUpgrade>
    <CUpgrade id="AP_ProtossGroundWeaponsLevel2">
        <!-- Override -->
        <EffectArray Reference="Weapon,PrologueZeratul,Level" Value="1"/>
        <EffectArray Reference="Effect,PrologueZeratul,Amount" Value="5"/>
        <EffectArray Operation="Set" Reference="Weapon,PrologueZeratul,Icon" Value="Assets\Textures\btn-upgrade-protoss-groundweaponslevel2.dds"/>
    </CUpgrade>
    <CUpgrade id="AP_ProtossGroundWeaponsLevel3">
        <!-- Override -->
        <EffectArray Reference="Weapon,PrologueZeratul,Level" Value="1"/>
        <EffectArray Reference="Effect,PrologueZeratul,Amount" Value="5"/>
        <EffectArray Operation="Set" Reference="Weapon,PrologueZeratul,Icon" Value="Assets\Textures\btn-upgrade-protoss-groundweaponslevel3.dds"/>
    </CUpgrade>
    <CUpgrade id="AP_ProtossGroundWeaponsLevel3">
        <!-- Override -->
        <EffectArray Reference="Weapon,PrologueZeratul,Level" Value="1"/>
        <EffectArray Reference="Effect,PrologueZeratul,Amount" Value="5"/>
        <EffectArray Operation="Set" Reference="Weapon,PrologueZeratul,Icon" Value="AP\Assets\Custom\Textures\btn-upgrade-protoss-groundarmorlevel4.dds"/>
    </CUpgrade>
    <CUpgrade id="AP_ProtossGroundWeaponsLevel5">
        <!-- Override -->
        <EffectArray Reference="Weapon,PrologueZeratul,Level" Value="1"/>
        <EffectArray Reference="Effect,PrologueZeratul,Amount" Value="5"/>
        <EffectArray Operation="Set" Reference="Weapon,PrologueZeratul,Icon" Value="AP\Assets\Custom\Textures\btn-upgrade-protoss-groundarmorlevel5.dds"/>
    </CUpgrade>
    <CUpgrade id="AP_BaseProtossGroundArmors">
        <!-- Override -->
        <EffectArray Reference="Unit,PrologueZeratul,LifeArmor" Value="1.000000"/>
        <EffectArray Reference="Unit,PrologueZeratul,LifeArmorLevel" Value="1"/>
    </CUpgrade>
    <CUpgrade id="AP_ProtossGroundArmorsQuatro">
        <!-- Override -->
        <EffectArray Reference="Unit,PrologueZeratul,LifeArmor" Value="1.000000"/>
        <EffectArray Reference="Unit,PrologueZeratul,LifeArmorLevel" Value="1"/>
    </CUpgrade>
    <CUpgrade id="AP_ProtossGroundArmorsPreplacedNoBuild">
        <!-- Override -->
        <EffectArray Reference="Unit,PrologueZeratul,LifeArmor" Value="1.000000"/>
        <EffectArray Reference="Unit,PrologueZeratul,LifeArmorLevel" Value="1"/>
    </CUpgrade>
    <CUpgrade id="AP_ProtossGroundArmorsLevel1">
        <!-- Override -->
        <EffectArray Reference="Unit,PrologueZeratul,LifeArmor" Value="1.000000"/>
        <EffectArray Reference="Unit,PrologueZeratul,LifeArmorLevel" Value="1"/>
        <EffectArray Operation="Set" Reference="Actor,PrologueZeratul,LifeArmorIcon" Value="Assets\Textures\btn-upgrade-protoss-groundarmorlevel1.dds"/>
    </CUpgrade>
    <CUpgrade id="AP_ProtossGroundArmorsLevel2">
        <!-- Override -->
        <EffectArray Reference="Unit,PrologueZeratul,LifeArmor" Value="1.000000"/>
        <EffectArray Reference="Unit,PrologueZeratul,LifeArmorLevel" Value="1"/>
        <EffectArray Operation="Set" Reference="Actor,PrologueZeratul,LifeArmorIcon" Value="Assets\Textures\btn-upgrade-protoss-groundarmorlevel2.dds"/>
    </CUpgrade>
    <CUpgrade id="AP_ProtossGroundArmorsLevel3">
        <!-- Override -->
        <EffectArray Reference="Unit,PrologueZeratul,LifeArmor" Value="1.000000"/>
        <EffectArray Reference="Unit,PrologueZeratul,LifeArmorLevel" Value="1"/>
        <EffectArray Operation="Set" Reference="Actor,PrologueZeratul,LifeArmorIcon" Value="Assets\Textures\btn-upgrade-protoss-groundarmorlevel3.dds"/>
    </CUpgrade>
    <CUpgrade id="AP_ProtossGroundArmorsLevel4">
        <!-- Override -->
        <EffectArray Reference="Unit,PrologueZeratul,LifeArmor" Value="1.000000"/>
        <EffectArray Reference="Unit,PrologueZeratul,LifeArmorLevel" Value="1"/>
        <EffectArray Operation="Set" Reference="Actor,PrologueZeratul,LifeArmorIcon" Value="AP\Assets\Custom\Textures\btn-upgrade-protoss-groundarmorlevel4.dds"/>
    </CUpgrade>
    <CUpgrade id="AP_ProtossGroundArmorsLevel5">
        <!-- Override -->
        <EffectArray Reference="Unit,PrologueZeratul,LifeArmor" Value="1.000000"/>
        <EffectArray Reference="Unit,PrologueZeratul,LifeArmorLevel" Value="1"/>
        <EffectArray Operation="Set" Reference="Actor,PrologueZeratul,LifeArmorIcon" Value="AP\Assets\Custom\Textures\btn-upgrade-protoss-groundarmorlevel5.dds"/>
    </CUpgrade>
    <CUpgrade id="AP_BaseProtossShields">
        <!-- Override -->
        <EffectArray Reference="Unit,PrologueZeratul,ShieldArmor" Value="1.000000"/>
        <EffectArray Reference="Unit,PrologueZeratul,ShieldArmorLevel" Value="1"/>
    </CUpgrade>
    <CUpgrade id="AP_ProtossShieldsQuatro">
        <!-- Override -->
        <EffectArray Reference="Unit,PrologueZeratul,ShieldArmor" Value="1.000000"/>
        <EffectArray Reference="Unit,PrologueZeratul,ShieldArmorLevel" Value="1"/>
    </CUpgrade>
    <CUpgrade id="AP_ProtossShieldsPreplacedNoBuild">
        <!-- Override -->
        <EffectArray Reference="Unit,PrologueZeratul,ShieldArmor" Value="1.000000"/>
        <EffectArray Reference="Unit,PrologueZeratul,ShieldArmorLevel" Value="1"/>
    </CUpgrade>
    <CUpgrade id="AP_ProtossShieldsLevel1">
        <!-- Override -->
        <EffectArray Reference="Unit,PrologueZeratul,ShieldArmor" Value="1.000000"/>
        <EffectArray Reference="Unit,PrologueZeratul,ShieldArmorLevel" Value="1"/>

        <EffectArray Operation="Set" Reference="Actor,PrologueZeratul,ShieldArmorIcon" Value="Assets\Textures\btn-upgrade-protoss-shieldslevel1.dds"/>
    </CUpgrade>
    <CUpgrade id="AP_ProtossShieldsLevel2">
        <!-- Override -->
        <EffectArray Reference="Unit,PrologueZeratul,ShieldArmor" Value="1.000000"/>
        <EffectArray Reference="Unit,PrologueZeratul,ShieldArmorLevel" Value="1"/>

        <EffectArray Operation="Set" Reference="Actor,PrologueZeratul,ShieldArmorIcon" Value="Assets\Textures\btn-upgrade-protoss-shieldslevel2.dds"/>
    </CUpgrade>
    <CUpgrade id="AP_ProtossShieldsLevel3">
        <!-- Override -->
        <EffectArray Reference="Unit,PrologueZeratul,ShieldArmor" Value="1.000000"/>
        <EffectArray Reference="Unit,PrologueZeratul,ShieldArmorLevel" Value="1"/>

        <EffectArray Operation="Set" Reference="Actor,PrologueZeratul,ShieldArmorIcon" Value="Assets\Textures\btn-upgrade-protoss-shieldslevel3.dds"/>
    </CUpgrade>
    <CUpgrade id="AP_ProtossShieldsLevel4">
        <!-- Override -->
        <EffectArray Reference="Unit,PrologueZeratul,ShieldArmor" Value="1.000000"/>
        <EffectArray Reference="Unit,PrologueZeratul,ShieldArmorLevel" Value="1"/>

        <EffectArray Operation="Set" Reference="Actor,PrologueZeratul,ShieldArmorIcon" Value="AP\Assets\Custom\Textures\btn-upgrade-protoss-shieldslevel4.dds"/>
    </CUpgrade>
    <CUpgrade id="AP_ProtossShieldsLevel5">
        <!-- Override -->
        <EffectArray Reference="Unit,PrologueZeratul,ShieldArmor" Value="1.000000"/>
        <EffectArray Reference="Unit,PrologueZeratul,ShieldArmorLevel" Value="1"/>

        <EffectArray Operation="Set" Reference="Actor,PrologueZeratul,ShieldArmorIcon" Value="AP\Assets\Custom\Textures\btn-upgrade-protoss-shieldslevel5.dds"/>
    </CUpgrade>
</Catalog>