<?xml version="1.0" encoding="utf-8" ?>
<Catalog xmlns:xsi="http://www.w3.org/2001/XMLSchema-instance" xsi:noNamespaceSchemaLocation="../../../../../../schemas/SchemaUpgradeData.xsd">
    <CUpgrade id="AP_BaseZergGroundArmors">
        <!-- Override -->
        <EffectArray Reference="Unit,ZaGara,LifeArmorLevel" Value="1"/>
        <EffectArray Reference="Unit,ZaGara,LifeArmor" Value="1"/>
    </CUpgrade>
    <CUpgrade id="AP_BaseZergMissileWeapons">
        <!-- Override -->
        <EffectArray Reference="Effect,ZaGaraAcidSpinesDamage,Amount" Value="3"/>
        <EffectArray Reference="Weapon,ZaGaraAcidSpines,Level" Value="1"/>
        <EffectArray Reference="Effect,ZaGaraTalonsDamage,Amount" Value="2"/>
        <EffectArray Reference="Weapon,ZaGaraTalons,Level" Value="1"/>
    </CUpgrade>
    <CUpgrade id="AP_ZergGroundArmorsLevel1">
        <!-- Override -->
        <EffectArray Reference="Unit,ZaGara,LifeArmorLevel" Value="1"/>
        <EffectArray Reference="Unit,ZaGara,LifeArmor" Value="1"/>
        <EffectArray Operation="Set" Reference="Actor,ZaGara,LifeArmorIcon" Value="Assets\Textures\btn-upgrade-zerg-groundcarapace-level1.dds"/>
    </CUpgrade>
    <CUpgrade id="AP_ZergGroundArmorsLevel2">
        <!-- Override -->
        <EffectArray Reference="Unit,ZaGara,LifeArmorLevel" Value="1"/>
        <EffectArray Reference="Unit,ZaGara,LifeArmor" Value="1"/>
        <EffectArray Operation="Set" Reference="Actor,ZaGara,LifeArmorIcon" Value="Assets\Textures\btn-upgrade-zerg-groundcarapace-level2.dds"/>
    </CUpgrade>
    <CUpgrade id="AP_ZergGroundArmorsLevel3">
        <!-- Override -->
        <EffectArray Reference="Unit,ZaGara,LifeArmorLevel" Value="1"/>
        <EffectArray Reference="Unit,ZaGara,LifeArmor" Value="1"/>
        <EffectArray Operation="Set" Reference="Actor,ZaGara,LifeArmorIcon" Value="Assets\Textures\btn-upgrade-zerg-groundcarapace-level3.dds"/>
    </CUpgrade>
    <CUpgrade id="AP_ZergGroundArmorsLevel4">
        <!-- Override -->
        <EffectArray Reference="Unit,ZaGara,LifeArmorLevel" Value="1"/>
        <EffectArray Reference="Unit,ZaGara,LifeArmor" Value="1"/>
        <EffectArray Operation="Set" Reference="Actor,ZaGara,LifeArmorIcon" Value="AP\Assets\Custom\Textures\btn-upgrade-zerg-groundcarapace-level4.dds"/>
    </CUpgrade>
    <CUpgrade id="AP_ZergGroundArmorsLevel5">
        <!-- Override -->
        <EffectArray Reference="Unit,ZaGara,LifeArmorLevel" Value="1"/>
        <EffectArray Reference="Unit,ZaGara,LifeArmor" Value="1"/>
        <EffectArray Operation="Set" Reference="Actor,ZaGara,LifeArmorIcon" Value="AP\Assets\Custom\Textures\btn-upgrade-zerg-groundcarapace-level5.dds"/>
    </CUpgrade>
    <CUpgrade id="AP_ZergMissileWeaponsLevel1">
        <!-- Override -->
        <EffectArray Reference="Effect,ZaGaraAcidSpinesDamage,Amount" Value="3"/>
        <EffectArray Reference="Weapon,ZaGaraAcidSpines,Level" Value="1"/>
        <EffectArray Reference="Effect,ZaGaraTalonsDamage,Amount" Value="2"/>
        <EffectArray Reference="Weapon,ZaGaraTalons,Level" Value="1"/>
        <EffectArray Operation="Set" Reference="Weapon,ZaGaraAcidSpines,Icon" Value="Assets\Textures\btn-upgrade-zerg-missileattacks-level1.dds"/>
        <EffectArray Operation="Set" Reference="Weapon,ZaGaraTalons,Icon" Value="Assets\Textures\btn-upgrade-zerg-missileattacks-level1.dds"/>
    </CUpgrade>
    <CUpgrade id="AP_ZergMissileWeaponsLevel2">
        <!-- Override -->
        <EffectArray Reference="Effect,ZaGaraAcidSpinesDamage,Amount" Value="3"/>
        <EffectArray Reference="Weapon,ZaGaraAcidSpines,Level" Value="1"/>
        <EffectArray Reference="Effect,ZaGaraTalonsDamage,Amount" Value="2"/>
        <EffectArray Reference="Weapon,ZaGaraTalons,Level" Value="1"/>
        <EffectArray Operation="Set" Reference="Weapon,ZaGaraAcidSpines,Icon" Value="Assets\Textures\btn-upgrade-zerg-missileattacks-level2.dds"/>
        <EffectArray Operation="Set" Reference="Weapon,ZaGaraTalons,Icon" Value="Assets\Textures\btn-upgrade-zerg-missileattacks-level2.dds"/>
    </CUpgrade>
    <CUpgrade id="AP_ZergMissileWeaponsLevel3">
        <!-- Override -->
        <EffectArray Reference="Effect,ZaGaraAcidSpinesDamage,Amount" Value="3"/>
        <EffectArray Reference="Weapon,ZaGaraAcidSpines,Level" Value="1"/>
        <EffectArray Reference="Effect,ZaGaraTalonsDamage,Amount" Value="2"/>
        <EffectArray Reference="Weapon,ZaGaraTalons,Level" Value="1"/>
        <EffectArray Operation="Set" Reference="Weapon,ZaGaraAcidSpines,Icon" Value="Assets\Textures\btn-upgrade-zerg-missileattacks-level3.dds"/>
        <EffectArray Operation="Set" Reference="Weapon,ZaGaraTalons,Icon" Value="Assets\Textures\btn-upgrade-zerg-missileattacks-level3.dds"/>
    </CUpgrade>
    <CUpgrade id="AP_ZergMissileWeaponsLevel4">
        <!-- Override -->
        <EffectArray Reference="Effect,ZaGaraAcidSpinesDamage,Amount" Value="3"/>
        <EffectArray Reference="Weapon,ZaGaraAcidSpines,Level" Value="1"/>
        <EffectArray Reference="Effect,ZaGaraTalonsDamage,Amount" Value="2"/>
        <EffectArray Reference="Weapon,ZaGaraTalons,Level" Value="1"/>
        <EffectArray Operation="Set" Reference="Weapon,ZaGaraAcidSpines,Icon" Value="AP\Assets\Custom\Textures\btn-upgrade-zerg-missileattacks-level4.dds"/>
        <EffectArray Operation="Set" Reference="Weapon,ZaGaraTalons,Icon" Value="AP\Assets\Custom\Textures\btn-upgrade-zerg-missileattacks-level4.dds"/>
    </CUpgrade>
    <CUpgrade id="AP_ZergMissileWeaponsLevel5">
        <!-- Override -->
        <EffectArray Reference="Effect,ZaGaraAcidSpinesDamage,Amount" Value="3"/>
        <EffectArray Reference="Weapon,ZaGaraAcidSpines,Level" Value="1"/>
        <EffectArray Reference="Effect,ZaGaraTalonsDamage,Amount" Value="2"/>
        <EffectArray Reference="Weapon,ZaGaraTalons,Level" Value="1"/>
        <EffectArray Operation="Set" Reference="Weapon,ZaGaraAcidSpines,Icon" Value="AP\Assets\Custom\Textures\btn-upgrade-zerg-missileattacks-level5.dds"/>
        <EffectArray Operation="Set" Reference="Weapon,ZaGaraTalons,Icon" Value="AP\Assets\Custom\Textures\btn-upgrade-zerg-missileattacks-level5.dds"/>
    </CUpgrade>
    <CUpgrade id="AP_K5CreepBonuses">
        <EffectArray Reference="Unit,ZaGara,AttackSpeedMultiplierCreep" Value="0.3"/>
        <EffectArray Reference="Unit,ZaGara,LifeRegenRateCreep" Value="0.820200"/>
        <EffectArray Reference="Unit,ZaGaraBurrowed,LifeRegenRateCreep" Value="0.820200"/>
    </CUpgrade>
</Catalog>